{"schemaVersion":1,"packageId":"fixture-map","displayName":"Fixture","sourceEvidence":{"revisionId":"fixture-map","sourceBundleHash":"b112381b345152b31db80d179b651477a0466e9a13eeeb79ac98d498914f93d1","briefHash":"9d00b8844c7089f2eea06dece3ea736964e4d6472a54a79926b68594f9dff8a2","provenanceId":"fixture-art","provenanceHash":"f33a5177f1556074a347fe578b3a8bbcb3329fcad6f7524c8a3e536046c63b40","mappingApprovalHash":"63bc47c1bc4ffc78a01d55c4ef3536aa777ec218eec3fff04fb06816455ef12d","rightsStatus":"owned"},"compatibility":{"rendererVersion":"1","elementLibraryVersion":"1"},"viewport":{"aspectRatio":"8:15","logicalWidth":960,"logicalHeight":1800,"cameraModel":"top-down","safeZones":[{"x":0,"y":0,"width":1,"height":0.1}]},"palette":{"water":"#123456","reflection":"#ffffff","weather":"#abcdef","atmosphere":"#eeeeee"},"layers":[{"id":"water","role":"water-base","zBand":0,"asset":"assets/atmosphere.webp","blendMode":"source-over","opacity":1,"parallax":0,"motion":{"maxInstances":0},"exclusionPolicy":"avoid-gameplay"}],"ambience":{},"exclusionZones":[],"semanticBindings":[],"protectedElements":{"frog.player":"inherit-only","surface.lily-pad.normal":"inherit-only","surface.lily-pad.sinking":"inherit-only","hazard.crocodile":"inherit-only","hazard.crocodile.warning-wake":"inherit-only","reward.flower":"inherit-only","reward.golden-lotus":"inherit-only","item.bomb":"inherit-only","item.bomb-pickup":"inherit-only","preview.jump-target":"inherit-only","ui.hud":"inherit-only","ui.control.dpad":"inherit-only","ui.control.bomb":"inherit-only"},"budgets":{"compressedBytes":20,"drawCalls":1,"visibleInstances":1,"motionInstances":0},"fallback":{"presetId":"neutral-water","color":"#123456","density":0.2}}
